{
  "type": "object",
  "additionalProperties": false,
  "properties": {
    "state_version": {
      "type": "integer",
      "minimum": 0,
      "maximum": 9223372036854775807
    },
    "role": {
      "enum": [
        "PLAINTIFF",
        "DEFENDANT"
      ]
    },
    "text": {
      "type": "string",
      "minLength": 1,
      "maxLength": 8000,
      "pattern": "\\S"
    },
    "context": {
      "type": "string",
      "minLength": 0,
      "maxLength": 16000
    }
  },
  "required": [
    "state_version",
    "role",
    "text"
  ],
  "$schema": "https://json-schema.org/draft/2020-12/schema",
  "$id": "urn:virtual-court:judge-v2:law-check-request:2026-09-13-split-endpoints",
  "title": "JudgeV2-law-check-request"
}
