{
  "state_version": 101,
  "role": "PLAINTIFF",
  "text": "问问问问问问问问问问问问问问问问问问问问问问问问问问问问问问问问问问问问问问问问问问问问问问问问问问问问问问问问问问问问问问问问问问问问问问问问问问问问问问问问问问问问问问问问问问问问问问问问问问问问问问问问问问问问问问问问问问问问问问问问问问问问问问问问问问问问问问问问问问问问问问问问问问问问问问问问问问问问问问问问问问问问问问问问问问问问问问问问问问问问问问问问问问问问问问问问问问问问问问问问问问问问问问问问问问问问问问问问问问问问问问问问问问问问问问问问问问问问问问问问问问问问问问问问问问问问问问问问问问问问问问问问问问问问问问问问问问问问问问问问问问问问问问问问问问问问问问问问问问问问问问问问问问问问问问问问问问问问问问问问问问问问问问问问问问问问问问问问问问问问问问问问问问问问问问问问问问问问问问问问问问问问问问问问问问问问问问问问问问问问问问问问问问问问问问问问问问问问问问问问问问问问问问问问问问问问问问问问问问问问问问问问问问问问问问问问问问问问问问问问问问问问问问问问问问问问问问问问问问问问问问问问问问问问问问问问问问问问问问问问问问问问问问问问问问问问问问问问问问问问问问问问问问问问问问问问问问问问问问问问问问问问问问问问问问问问问问问问问问问问问问问问问问问问问问问问问问问问问问问问问问问问问问问问问问问问问问问问问问问问问问问问问问问问问问问问问问问问问问问问问问问问问问问问问问问问问问问问问问问问问问问问问问问问问问问问问问问问问问问问问问问问问问问问问问问问问问问问问问问问问问问问问问问问问问问问问问问问问问问问问问问问问问问问问问问问问问问问问问问问问问问问问问问问问问问问问问问问问问问问问问问问问问问问问问问问问问问问问问问问问问问问问问问问问问问问问问问问问问问问问问问问问问问问问问问问问问问问问问问问问问问问问问问问问问问问问问问问问问问问问问问问问问问问问问问问问问问问问问问问问问问问问问问问问问问问问问问问问问问问问问问问问问问问问问问问问问问问问问问问问问问问问问问问问问问问问问问问问问问问问问问问问问问问问问问问问问问问问问问问问问问问问问问问问问问问问问问问问问问问问问问问问问问问问问问问问问问问问问问问问问问问问问问问问问问问问问问问问问问问问问问问问问问问问问问问问问问问问问问问问问问问问问问问问问问问问问问问问问问问问问问问问问问问问问问问问问问问问问问问问问问问问问问问问问问问问问问问问问问问问问问问问问问问问问问问问问问问问问问问问问问问问问问问问问问问问问问问问问问问问问问问问问问问问问问问问问问问问问问问问问问问问问问问问问问问问问问问问问问问问问问问问问问问问问问问问问问问问问问问问问问问问问问问问问问问问问问问问问问问问问问问问问问问问问问问问问问问问问问问问问问问问问问问问问问问问问问问问问问问问问问问问问问问问问问问问问问问问问问问问问问问问问问问问问问问问问问问问问问问问问问问问问问问问问问问问问问问问问问问问问问问问问问问问问问问问问问问问问问问问问问问问问问问问问问问问问问问问问问问问问问问问问问问问问问问问问问问问问问问问问问问问问问问问问问问问问问问问问问问问问问问问问问问问问问问问问问问问问问问问问问问问问问问问问问问问问问问问问问问问问问问问问问问问问问问问问问问问问问问问问问问问问问问问问问问问问问问问问问问问问问问问问问问问问问问问问问问问问问问问问问问问问问问问问问问问问问问问问问问问问问问问问问问问问问问问问问问问问问问问问问问问问问问问问问问问问问问问问问问问问问问问问问问问问问问问问问问问问问问问问问问问问问问问问问问问问问问问问问问问问问问问问问问问问问问问问问问问问问问问问问问问问问问问问问问问问问问问问问问问问问问问问问问问问问问问问问问问问问问问问问问问问问问问问问问问问问问问问问问问问问问问问问问问问问问问问问问问问问问问问问问问问问问问问问问问问问问问问问问问问问问问问问问问问问问问问问问问问问问问问问问问问问问问问问问问问问问问问问问问问问问问问问问问问问问问问问问问问问问问问问问问问问问问问问问问问问问问问问问问问问问问问问问问问问问问问问问问问问问问问问问问问问问问问问问问问问问问问问问问问问问问问问问问问问问问问问问问问问问问问问问问问问问问问问问问问问问问问问问问问问问问问问问问问问问问问问问问问问问问问问问问问问问问问问问问问问问问问问问问问问问问问问问问问问问问问问问问问问问问问问问问问问问问问问问问问问问问问问问问问问问问问问问问问问问问问问问问问问问问问问问问问问问问问问问问问问问问问问问问问问问问问问问问问问问问问问问问问问问问问问问问问问问问问问问问问问问问问问问问问问问问问问问问问问问问问问问问问问问问问问问问问问问问问问问问问问问问问问问问问问问问问问问问问问问问问问问问问问问问问问问问问问问问问问问问问问问问问问问问问问问问问问问问问问问问问问问问问问问问问问问问问问问问问问问问问问问问问问问问问问问问问问问问问问问问问问问问问问问问问问问问问问问问问问问问问问问问问问问问问问问问问问问问问问问问问问问问问问问问问问问问问问问问问问问问问问问问问问问问问问问问问问问问问问问问问问问问问问问问问问问问问问问问问问问问问问问问问问问问问问问问问问问问问问问问问问问问问问问问问问问问问问问问问问问问问问问问问问问问问问问问问问问问问问问问问问问问问问问问问问问问问问问问问问问问问问问问问问问问问问问问问问问问问问问问问问问问问问问问问问问问问问问问问问问问问问问问问问问问问问问问问问问问问问问问问问问问问问问问问问问问问问问问问问问问问问问问问问问问问问问问问问问问问问问问问问问问问问问问问问问问问问问问问问问问问问问问问问问问问问问问问问问问问问问问问问问问问问问问问问问问问问问问问问问问问问问问问问问问问问问问问问问问问问问问问问问问问问问问问问问问问问问问问问问问问问问问问问问问问问问问问问问问问问问问问问问问问问问问问问问问问问问问问问问问问问问问问问问问问问问问问问问问问问问问问问问问问问问问问问问问问问问问问问问问问问问问问问问问问问问问问问问问问问问问问问问问问问问问问问问问问问问问问问问问问问问问问问问问问问问问问问问问问问问问问问问问问问问问问问问问问问问问问问问问问问问问问问问问问问问问问问问问问问问问问问问问问问问问问问问问问问问问问问问问问问问问问问问问问问问问问问问问问问问问问问问问问问问问问问问问问问问问问问问问问问问问问问问问问问问问问问问问问问问问问问问问问问问问问问问问问问问问问问问问问问问问问问问问问问问问问问问问问问问问问问问问问问问问问问问问问问问问问问问问问问问问问问问问问问问问问问问问问问问问问问问问问问问问问问问问问问问问问问问问问问问问问问问问问问问问问问问问问问问问问问问问问问问问问问问问问问问问问问问问问问问问问问问问问问问问问问问问问问问问问问问问问问问问问问问问问问问问问问问问问问问问问问问问问问问问问问问问问问问问问问问问问问问问问问问问问问问问问问问问问问问问问问问问问问问问问问问问问问问问问问问问问问问问问问问问问问问问问问问问问问问问问问问问问问问问问问问问问问问问问问问问问问问问问问问问问问问问问问问问问问问问问问问问问问问问问问问问问问问问问问问问问问问问问问问问问问问问问问问问问问问问问问问问问问问问问问问问问问问问问问问问问问问问问问问问问问问问问问问问问问问问问问问问问问问问问问问问问问问问问问问问问问问问问问问问问问问问问问问问问问问问问问问问问问问问问问问问问问问问问问问问问问问问问问问问问问问问问问问问问问问问问问问问问问问问问问问问问问问问问问问问问问问问问问问问问问问问问问问问问问问问问问问问问问问问问问问问问问问问问问问问问问问问问问问问问问问问问问问问问问问问问问问问问问问问问问问问问问问问问问问问问问问问问问问问问问问问问问问问问问问问问问问问问问问问问问问问问问问问问问问问问问问问问问问问问问问问问问问问问问问问问问问问问问问问问问问问问问问问问问问问问问问问问问问问问问问问问问问问问问问问问问问问问问问问问问问问问问问问问问问问问问问问问问问问问问问问问问问问问问问问问问问问问问问问问问问问问问问问问问问问问问问问问问问问问问问问问问问问问问问问问问问问问问问问问问问问问问问问问问问问问问问问问问问问问问问问问问问问问问问问问问问问问问问问问问问问问问问问问问问问问问问问问问问问问问问问问问问问问问问问问问问问问问问问问问问问问问问问问问问问问问问问问问问问问问问问问问问问问问问问问问问问问问问问问问问问问问问问问问问问问问问问问问问问问问问问问问问问问问问问问问问问问问问问问问问问问问问问问问问问问问问问问问问问问问问问问问问问问问问问问问问问问问问问问问问问问问问问问问问问问问问问问问问问问问问问问问问问问问问问问问问问问问问问问问问问问问问问问问问问问问问问问问问问问问问问问问问问问问问问问问问问问问问问问问问问问问问问问问问问问问问问问问问问问问问问问问问问问问问问问问问问问问问问问问问问问问问问问问问问问问问问问问问问问问问问问问问问问问问问问问问问问问问问问问问问问问问问问问问问问问问问问问问问问问问问问问问问问问问问问问问问问问问问问问问问问问问问问问问问问问问问问问问问问问问问问问问问问问问问问问问问问问问问问问问问问问问问问问问问问问问问问问问问问问问问问问问问问问问问问问问问问问问问问问问问问问问问问问问问问问问问问问问问问问问问问问问问问问问问问问问问问问问问问问问问问问问问问问问问问问问问问问问问问问问问问问问问问问问问问问问问问问问问问问问问问问问问问问问问问问问问问问问问问问问问问问问问问问问问问问问问问问问问问问问问问问问问问问问问问问问问问问问问问问问问问问问问问问问问问问问问问问问问问问问问问问问问问问问问问问问问问问问问问问问问问问问问问问问问问问问问问问问问问问问问问问问问问问问问问问问问问问问问问问问问问问问问问问问问问问问问问问问问问问问问问问问问问问问问问问问问问问问问问问问问问问问问问问问问问问问问问问问问问问问问问问问问问问问问问问问问问问问问问问问问问问问问问问问问问问问问问问问问问问问问问问问问问问问问问问问问问问问问问问问问问问问问问问问问问问问问问问问问问问问问问问问问问问问问问问问问问问问问问问问问问问问问问问问问问问问问问问问问问问问问问问问问问问问问问问问问问问问问问问问问问问问问问问问问问问问问问问问问问问问问问问问问问问问问问问问问问问问问问问问问问问问问问问问问问问问问问问问问问问问问问问问问问问问问问问问问问问问问问问问问问问问问问问问问问问问问问问问问问问问问问问问问问问问问问问问问问问问问问问问问问问问问问问问问问问问问问问问问问问问问问问问问问问问问问问问问问问问问问问问问问问问问问问问问问问问问问问问问问问问问问问问问问问问问问问问问问问问问问问问问问问问问问问问问问问问问问问问问问问问问问问问问问问问问问问问问问问问问问问问问问问问问问问问问问问问问问问问问问问问问问问问问问问问问问问问问问问问问问问问问问问问问问问问问问问问问问问问问问问问问问问问问问问问问问问问问问问问问问问问问问问问问问问问问问问问问问问问问问问问问问问问问问问问问问问问问问问问问问问问问问问问问问问问问问问问问问问问问问问问问问问问问问问问问问问问问问问问问问问问问问问问问问问问问问问问问问问问问问问问问问问问问问问问问问问问问问问问问问问问问问问问问问问问问问问问问问问问问问问问问问问问问问问问问问问问问问问问问问问问问问问问问问问问问问问问问问问问问问问问问问问问问问问问问问问问问问问问问问问问问问问问问问问问问问问问问问问问问问问问问问问问问问问问问问问问问问问问问问问问问问问问问问问问问问问问问问问问问问问问问问问问问问问问问问问问问问问问问问问问问问问问问问问问问问问问问问问问问问问问问问问问问问问问问问问问问问问问问问问问问问问问问问问问问问问问问问问问问问问问问问问问问问问问问问问问问问问问问问问问问问问问问问问问问问问问问问问问问问问问问问问问问问问问问问问问问问问问问问问问问问问问问问问问问问问问问问问问问问问问问问问问问问问问问问问问问问问问问问问问问问问问问问问问问问问问问问问问问问问问问问问问问问问问问问问问问问问问问问问问问问问问问问问问问问问问问问问问问问问问问问问问问问问问问问问问问问问问问问问问问问问问问问问问问问问问问问问问问问问问问问问问问问问问问问问问问问问问问问问问问问问问问问问问问问问问问问问问问问问问问问问问问问问问问问问问问问问问问问问问问问问问问问问问问问问问问问问问问问问问问问问问问问问问问问问问问问问问问问问问问问问问问问问问问问问问问问问问问问问问问问问问问问问问问问问问问问问问问问问问问问问问问问问问问问问问问问问问问问问问问问问问问问问问问问问问问问问问问问问问问问问问问问问问问问问问问问问问问问问问问问问问问问问问问问问问问问问问问问问问问问问问问问问问问问问问问问问问问问问问问问问问问问问问问问问问问问问问问问问问问问问问问问问问问问问问问问问问问问问问问问问问问问问问问问问问问问问问问问问问问问问问问问问问问问问问问问问问问问问问问问问问问问问问问问问问问问问问问问问问问问问问问问问问问问问问问问问问问问问问问问问问问问问问问问问问问问问问问问问问问问问问问问问问问问问问问问问问问问问问问问问问问问问问问问问问问问问问问问问问问问问问问问问问问问问问问问问问问问问问问问问问问问问问问问问问问问问问问问问问问问问问问问问问问问问问问问问问问问问问问问问问问问问问问问问问问问问问问问问问问问问问问问问问问问问问问问问问问问问问问问问问问问问问问问问问问问问问问问问问问问问问问问问问问问问问问问问问问问问问问问问问问问问问问问问问问问问问问问问问问问问问问问问问问问问问问问问问问问问问问问问问问问问问问问问问问问问问问问问问问问问问问问问问问问问问问问问问问问问问问问问问问问问问问问问问问问问问问问问问问问问问问问问问问问问问问问问问问问问问问问问问问问问问问问问问问问问问问问问问问问问问问问问问问问问问问问问问问问问问问问问问问问问问问问问问问问问问问问问问问问问问问问问问问问问问问问问问问问问问问问问问问问问问问问问问问问问问问问问问问问问问问问问问问问问问问问问问问问问问问问问问问问问问问问问问问问问问问问问问问问问问问问问问问问问问问问问问问问问问问问问问问问问问问问问问问问问问问问问问问问问问问问问问问问问问问问问问问问问问问问问问问问问问问问问问问问问问问问问问问问问问问问问问问问问问问问问问问问问问问问问问问问问问问问问问问问问问问问问问问问问问问问问问问问问问问问问问问问问问问问问问问问问问问问问问问问问问问问问问问问问问问问问问问问问问问问问问问问问问问问问问问问问问问问问问问问问问问问问问问问问问问问问问问问问问问问问问问问问问问问问问问问问问问问问问问问问问问问问问问问问问问问问问问问问问问问问问问问问问问问问问问问问问问问问问问问问问问问问问问问问问问问问问问问问问问问问问问问问问问问问问问问问问问问问问问问问问问问问问问问问问问问问问问问问问问问问问问问问问问问问问问问问问问问问问问问问问问问问问问问问问问问问问问问问问问问问问问问问问问问问问问问问问问问问问问问问问问问问问问问问问问问问问问问问问问问问问问问问问问问问问问问问问问问问问问问问问问问问问问问问问问问问问问问问问问问问问问问问问问问问问问问问问问问问问问问问问问问问问问问问问问问问问问问问问问问问问问问问问问问问问问问问问问问问问问问问问问问问问问问问问问问问问问问问问问问问问问问问问问问问问问问问问问问问问问问问问问问问问问问问问问问问问问问问问问问问问问问问问问问问问问问问问问问问问问问问问问问问问问问问问问问问问问问问问问问问问问问问问问问问问问问问问问问问问问问问问问问问问问问问问问问问问问问问问问问问问问问问问问问问问问问问问问问问问问问问问问问问问问问问问问问问问问问问问问问问问问问问问问问问问问问问问问问问问问问问问问问问问问问问问问问问问问问问问问问问问问问问问问问问问问问问问问问问问问问问问问问问问问问问问问问问问问问问问问问问问问问问问问问问问问问问问问问问问问问问问问问问问问问问问问问问问问问问问问问问问问问问问问问问问问问问问问问问问问问问问问问问问问问问问问问问问问问问问问问问问问问问问问问问问问问问问问问问问问问问问问问问问问问问问问问问问问问问问问问问问问问问问问问问问问问问问问问问问问问问问问问问问问问问问问问问问问问问问问问问问问问问问问问问问问问问问问问问问问问问问问问问问问问问问问问问问问问问问问问问问问问问问问问问问问问问问问问问问问问问问问问问问问问问问问问问问问问问问问问问问问问问问问问问问问问问问问问问问问问问问问问问问问问问问问问问问问问问问问问问问问问问问问问问问问问问问问问问问问问问问问问问问问问问问问问问问问问问问问问问问问问问问问问问问问问问问问问问问问问问问问问问问问问问问问问问问问问问问问问问问问问问问问问问问问问问问问问问问问问问问问问问问问问问问问问问问问问问问问问问问问问问问问问问问问问问问问问问问问问问问问问问问问问问问问问问问问问问问问问问问问问问问问问问问问问问问问问问问问问问问问问问问问问问问问问问问问问问问问问问问问问问问问问问问问问问问问问问问问问问问问问问问问问问问问问问问问问问问问问问问问问问问问问问问问问问问问问问问问问问问问问问问问问问问问问问问问问问问问问问问问问问问问问问问问问问问问问问问问问问问问问问问问问问问问问问问问问问问问问问问问问问问问问问问问问问问问问问问问问问问问问问问问问问问问问问问问问问问问问问问问问问问问问问问问问问问问问问问问问问问问问问问问问问问问问问问问问问问问问问问问问问问问问问问问问问问问问问问问问问问问问问问问问问问问问问问问问问问问问问问问问问问问问问问问问问问问问问问问问问问问问问问问问问问问问问问问问问问问问问问问问问问问问问问问问问问问问问问问问问问问问问问问问问问问问问问问问问问问问问问问问问问问问问问问问问问问问问问问问问问问问问问问问问问问问问问问问问问问问问问问问问问问问问问问问问问问问问问问问问问问问问问问问问问问问问问问问问问问问问问问问问问问问问问问问问问问问问问问问问问问问问问问问问问问问问问问问问问问问问问问问问问问问问问问问问问问问问问问问问问问问问问问问问问问问问问问问问问问问问问问问问问问问问问问问问问问问问问问问问问问问问问问问问问问问问问问问问问问问问问问问问问问问问问问问问问问问问问问问问问问问问问问问问问问问问问问问问问问问问问问问问问问问问问问问问问问问问问问问问问问问问问问问问问问问问问问问问问问问问问问问问问问问问问问问问问问问问问问问问问问问问问问问问问问问问问问问问问问问问问问问问问问问问问问问问问问问问问问",
  "context": "当前争点：赔偿金额及维权费用是否合理。"
}
